{
  "verification_id": "toy-verify-accept",
  "fact_id": "toy-odd-sum",
  "outcome": "ACCEPT",
  "verifier": "toy-independent-verifier",
  "verifier_role": "theorem_verifier",
  "cold_start": true,
  "dependencies_checked": [],
  "sources_checked": [],
  "checklist": [
    {"item": "statement and quantifiers", "result": "PASS", "note": "Integer domain and empty sum are explicit."},
    {"item": "base case", "result": "PASS", "note": "n=0 gives 0=0."},
    {"item": "induction step", "result": "PASS", "note": "n^2+2n+1=(n+1)^2."},
    {"item": "dependencies and edge cases", "result": "PASS", "note": "No external dependencies; n=0 included."}
  ],
  "fatal_gap": null,
  "repair_direction": null,
  "missing_information": [],
  "limitations": ["This toy verifier fixture is not human peer review."],
  "created_at": "2026-07-24T00:00:00+08:00"
}
